#FILE	SEQUENCE	START	END	STRAND	GENE	COVERAGE	COVERAGE_MAP	GAPS	%COVERAGE	%IDENTITY	DATABASE	ACCESSION	PRODUCT	RESISTANCE
input/CP182383.fasta	CP182383.1	219230	220054	+	gadX	1-825/825	===============	0/0	100.00	100.00	card	AP009048.1:3974604-3975429	GadX is an AraC-family regulator that promotes mdtEF expression to confer multidrug resistance.	fluoroquinolone;macrolide;penam
input/CP182383.fasta	CP182383.1	220422	221150	+	gadW	1-729/729	===============	0/0	100.00	94.65	card	CP015085.1:2552440-2551711	GadW is an AraC-family regulator that promotes mdtEF expression to confer multidrug resistance. GadW inhibits GadX-dependent activation. GadW clearly represses gadX and in situations where GadX is missing activates gadA and gadBC.	fluoroquinolone;macrolide;penam
input/CP182383.fasta	CP182383.1	221513	224626	-	mdtF	1-3114/3114	===============	0/0	100.00	99.97	card	U00096:3660413-3663527	MdtF is the multidrug inner membrane transporter for the MdtEF-TolC efflux complex.	fluoroquinolone;macrolide;penam
input/CP182383.fasta	CP182383.1	224651	225808	-	mdtE	1-1158/1158	===============	0/0	100.00	100.00	card	AP009048.1:3981183-3980025	MdtE is the membrane fusion protein of the MdtEF multidrug efflux complex. It shares 70% sequence similarity with AcrA.	fluoroquinolone;macrolide;penam
input/CP182383.fasta	CP182383.1	424535	425167	-	CRP	1-633/633	===============	0/0	100.00	99.84	card	AP009048.1:4154296-4153663	CRP is a global regulator that represses MdtEF multidrug efflux pump expression.	fluoroquinolone;macrolide;penam
input/CP182383.fasta	CP182383.1	700558	701379	+	bacA	1-822/822	===============	0/0	100.00	100.00	card	U00096.3:3204131-3203309	The bacA gene product (BacA) recycles undecaprenyl pyrophosphate during cell wall biosynthesis which confers resistance to bacitracin.	peptide
input/CP182383.fasta	CP182383.1	725093	726580	-	tolC	1-1488/1488	===============	0/0	100.00	100.00	card	FJ768952:0-1488	TolC is a protein subunit of many multidrug efflux complexes in Gram negative bacteria. It is an outer membrane efflux protein and is constitutively open. Regulation of efflux activity is often at its periplasmic entrance by other components of the efflux complex.	aminocoumarin;aminoglycoside;carbapenem;cephalosporin;cephamycin;fluoroquinolone;glycylcycline;macrolide;penam;penem;peptide;phenicol;rifamycin;tetracycline;triclosan
input/CP182383.fasta	CP182383.1	1170203	1171741	-	emrB	1-1539/1539	===============	0/0	100.00	100.00	card	U00096:2812615-2814154	emrB is a translocase in the emrB -TolC efflux protein in E. coli. It recognizes substrates including carbonyl cyanide m-chlorophenylhydrazone (CCCP) nalidixic acid and thioloactomycin.	fluoroquinolone
input/CP182383.fasta	CP182383.1	1171758	1172930	-	emrA	1-1173/1173	===============	0/0	100.00	100.00	card	AP009048:2810082-2811255	EmrA is a membrane fusion protein providing an efflux pathway with EmrB and TolC between the inner and outer membranes of E. coli a Gram-negative bacterium.	fluoroquinolone
input/CP182383.fasta	CP182383.1	1173057	1173587	-	emrR	1-531/531	===============	0/0	100.00	100.00	card	U00096.3:2810769-2811300	EmrR is a negative regulator for the EmrAB-TolC multidrug efflux pump in E. coli. Mutations lead to EmrAB-TolC overexpression.	fluoroquinolone
input/CP182383.fasta	CP182383.1	1361365	1361841	-	mphB	1-477/477	===============	0/0	100.00	98.32	card	AE005174.2:3397370-3397847	The mphB gene encodes for MPH(2')-II. This enzymes phosphorylates 14-membered and 16-membered macrolides.  It phosphorylates macrolides in GTP- dependent manner at 2'-OH hydroxyl of desosamine sugar of macrolides.	macrolide
input/CP182383.fasta	CP182383.1	1382527	1385640	-	acrD	1-3114/3114	===============	0/0	100.00	100.00	card	AP009048.1:2586250-2589364	AcrD is an aminoglycoside efflux pump expressed in E. coli. Its expression can be induced by indole and is regulated by baeRS and cpxAR.	aminoglycoside
input/CP182383.fasta	CP182383.1	1417010	1418314	-	Escherichia_coli_ampC1_beta-lactamase	1-1305/1305	===============	0/0	100.00	100.00	card	FN649414.1:2765050-2766355	An ampC-like beta-lactamase identified from Escherichia coli.	cephalosporin;penam
input/CP182383.fasta	CP182383.1	1476945	1480538	-	evgS	1-3594/3594	===============	0/0	100.00	99.94	card	U00096:2484373-2487967	EvgS is a sensor protein that phosphorylates the regulatory protein EvgA. evgS corresponds to 1 locus in Pseudomonas aeruginosa PAO1 and 1 locus in Pseudomonas aeruginosa LESB58.	fluoroquinolone;macrolide;penam;tetracycline
input/CP182383.fasta	CP182383.1	1480543	1481157	-	evgA	1-615/615	===============	0/0	100.00	100.00	card	BA000007.3:3212025-3212640	EvgA when phosphorylated is a positive regulator for efflux protein complexes emrKY and mdtEF. While usually phosphorylated in a EvgS dependent manner it can be phosphorylated in the absence of EvgS when overexpressed.	fluoroquinolone;macrolide;penam;tetracycline
input/CP182383.fasta	CP182383.1	1481681	1482736	+	emrK	1-1056/1056	===============	0/0	100.00	100.00	card	D78168:536-1592	emrK is a membrane fusion protein that is a homolog of EmrA. Together with the inner membrane transporter EmrY and the outer membrane channel TolC it mediates multidrug efflux.	tetracycline
input/CP182383.fasta	CP182383.1	1482736	1484274	+	emrY	1-1539/1539	===============	0/0	100.00	99.94	card	D78168:1591-3130	emrY is a multidrug transport that moves substrates across the inner membrane of the Gram-negative E. coli. It is a homolog of emrB.	tetracycline
input/CP182383.fasta	CP182383.1	1622821	1623789	-	pmrF	1-969/969	===============	0/0	100.00	100.00	card	U00096:2367070-2368039	PmrF is required for the synthesis and transfer of 4-amino-4-deoxy-L-arabinose (Ara4N) to Lipid A which allows gram-negative bacteria to resist the antimicrobial activity of cationic antimicrobial peptides and antibiotics such as polymyxin. pmrF corresponds to 1 locus in Pseudomonas aeruginosa PAO1 and 1 locus in Pseudomonas aeruginosa LESB58.	peptide
input/CP182383.fasta	CP182383.1	1682245	1683888	+	yojI	1-1644/1644	===============	0/0	100.00	100.00	card	U00096.3:2308615-2306971	YojI mediates resistance to the peptide antibiotic microcin J25 when it is expressed from a multicopy vector. YojI is capable of pumping out microcin molecules.  The outer membrane protein TolC in addition to YojI is required for export of microcin J25 out of the cell. Microcin J25 is thus the first known substrate for YojI.	peptide
input/CP182383.fasta	CP182383.1	1833034	1833756	-	baeR	1-723/723	===============	0/0	100.00	99.58	card	AP009048.1:2166412-2167135	BaeR is a response regulator that promotes the expression of MdtABC and AcrD efflux complexes.	aminocoumarin;aminoglycoside
input/CP182383.fasta	CP182383.1	1833753	1835156	-	baeS	1-1404/1404	===============	0/0	100.00	100.00	card	AP009048:2165012-2166416	BaeS is a sensor kinase in the BaeSR regulatory system. While it phosphorylates BaeR to increase its activity BaeS is not necessary for overexpressed BaeR to confer resistance.	aminocoumarin;aminoglycoside
input/CP182383.fasta	CP182383.1	1836569	1839646	-	mdtC	1-3078/3078	===============	0/0	100.00	98.77	card	U00096:2158385-2161463	MdtC is a transporter that forms a heteromultimer complex with MdtB to form a multidrug transporter. MdtBC is part of the MdtABC-TolC efflux complex. In the absence of MdtB MdtC can form a homomultimer complex that results in a functioning efflux complex with a narrower drug specificity. mdtC corresponds to 3 loci in Pseudomonas aeruginosa PAO1 (gene name: muxC/muxB) and 3 loci in Pseudomonas aeruginosa LESB58.	aminocoumarin
input/CP182383.fasta	CP182383.1	1839647	1842769	-	mdtB	1-3123/3123	===============	0/0	100.00	98.66	card	U00096:2155262-2158385	MdtB is a transporter that forms a heteromultimer complex with MdtC to form a multidrug transporter. MdtBC is part of the MdtABC-TolC efflux complex.	aminocoumarin
input/CP182383.fasta	CP182383.1	1842769	1844016	-	mdtA	1-1248/1248	===============	0/0	100.00	97.92	card	U00096:2154015-2155263	MdtA is the membrane fusion protein of the multidrug efflux complex mdtABC.	aminocoumarin
input/CP182383.fasta	CP182383.1	1897231	1898397	+	ugd	1-1167/1167	===============	0/0	100.00	95.54	card	U00096:2099613-2098446	PmrE is required for the synthesis and transfer of 4-amino-4-deoxy-L-arabinose (Ara4N) to Lipid A which allows gram-negative bacteria to resist the antimicrobial activity of cationic antimicrobial peptides and antibiotics such as polymyxin	peptide
input/CP182383.fasta	CP182383.1	2393953	2394336	-	marA	1-384/384	===============	0/0	100.00	100.00	card	AP009048.1:1621287-1621671	In the presence of antibiotic stress E. coli overexpresses the global activator protein MarA which besides inducing MDR efflux pump AcrAB also down- regulates synthesis of the porin OmpF.	carbapenem;cephalosporin;cephamycin;fluoroquinolone;glycylcycline;monobactam;penam;penem;phenicol;rifamycin;tetracycline;triclosan
input/CP182383.fasta	CP182383.1	2728955	2729368	+	H-NS	1-414/414	===============	0/0	100.00	99.28	card	BA000007.3:1738104-1737690	H-NS is a histone-like protein involved in global gene regulation in Gram-negative bacteria. It is a repressor of the membrane fusion protein genes acrE mdtE and emrK as well as nearby genes of many RND-type multidrug exporters.	cephalosporin;cephamycin;fluoroquinolone;macrolide;penam;tetracycline
input/CP182383.fasta	CP182383.1	2882682	2883890	+	mdtH	1-1209/1209	===============	0/0	100.00	100.00	card	U00096:1125326-1124117	Multidrug resistance protein MdtH	fluoroquinolone
input/CP182383.fasta	CP182383.1	2892519	2893745	+	mdtG	1-1227/1227	===============	0/0	100.00	99.43	card	CP000800.1:1192954-1191727	The MdtG protein also named YceE appears to be a member of the major facilitator superfamily of transporters and it has been reported when overexpressed to increase fosfomycin and deoxycholate resistances. mdtG is a member of the marA-soxS-rob regulon.	fosfomycin
input/CP182383.fasta	CP182383.1	3038183	3039931	-	msbA	1-1749/1749	===============	0/0	100.00	100.00	card	U00096.3:966620-968369	MsbA is a multidrug resistance transporter homolog from E. coli and belongs to a superfamily of transporters that contain an adenosine triphosphate (ATP) binding cassette (ABC) which is also called a nucleotide-binding domain (NBD). MsbA is a member of the MDR-ABC transporter group by sequence homology. MsbA transports lipid A a major component of the bacterial outer cell membrane and is the only bacterial ABC transporter that is essential for cell viability.	nitroimidazole
input/CP182383.fasta	CP182383.1	3157598	3158830	-	Escherichia_coli_mdfA	1-1233/1233	===============	0/0	100.00	98.38	card	JQ394987:0-1233	Multidrug efflux pump in E. coli. This multidrug efflux system was originally identified as the Cmr/CmlA chloramphenicol exporter.	benzalkonium_chloride;rhodamine;tetracycline
input/CP182383.fasta	CP182383.1	3324283	3324960	+	kdpE	1-678/678	===============	0/0	100.00	100.00	card	U00096.3:721733-721055	kdpE is a transcriptional activator that is part of the two-component system KdpD/KdpE that is studied for its regulatory role in potassium transport and has been identified as an adaptive regulator involved in the virulence and intracellular survival of pathogenic bacteria. kdpE regulates a range of virulence loci through direct promoter binding.	aminoglycoside
input/CP182383.fasta	CP182383.1	3552393	3553586	+	Escherichia_coli_acrA	1-1194/1194	===============	0/0	100.00	100.00	card	U00096.3:485619-484425	AcrA is a subunit of the AcrAB-TolC multidrug efflux system that in E. coli.	cephalosporin;fluoroquinolone;glycylcycline;penam;phenicol;rifamycin;tetracycline;triclosan
input/CP182383.fasta	CP182383.1	3553609	3556758	+	acrB	1-3150/3150	===============	0/0	100.00	100.00	card	U00096.3:484403-481253	Protein subunit of AcrA-AcrB-TolC multidrug efflux complex. AcrB functions as a herterotrimer which forms the inner membrane component and is primarily responsible for substrate recognition and energy transduction by acting as a drug/proton antiporter.	cephalosporin;fluoroquinolone;glycylcycline;penam;phenicol;rifamycin;tetracycline;triclosan
input/CP182383.fasta	CP182383.1	3641725	3642882	+	Escherichia_coli_ampH	1-1158/1158	===============	0/0	100.00	100.00	card	AP012030.1:396711-395553	AmpH is a class C ampC-like beta-lactamase and penicillin-binding protein identified in Escherichia coli.	cephalosporin;penam
input/CP182383.fasta	CP182383.1	4108277	4109509	+	mdtM	1-1233/1233	===============	0/0	100.00	97.16	card	U00096.3:4568519-4567286	Multidrug resistance protein MdtM	acridine_dye;fluoroquinolone;lincosamide;nucleoside;phenicol
input/CP182383.fasta	CP182383.1	4309103	4310236	+	Escherichia_coli_ampC	1-1134/1134	===============	0/0	100.00	99.91	card	U00096.3:4378944-4377810	A class C ampC beta-lactamase (cephalosporinase) enzyme described in Escherichia coli shown clinically to confer resistance to penicillin-like and cephalosporin-class antibiotics.	cephalosporin;penam
input/CP182383.fasta	CP182383.1	4352458	4354101	+	eptA	1-1644/1644	===============	0/0	100.00	99.94	card	AP009048:4340268-4338624	PmrC mediates the modification of Lipid A by the addition of 4-amino-4-deoxy-L-arabinose (L-Ara4N) and phosphoethanolamine resulting in a less negative cell membrane and decreased binding of polymyxin B.	peptide
input/CP182383.fasta	CP182383.1	4383839	4384870	+	mdtN	1-1032/1032	===============	0/0	100.00	100.00	card	AP009048.1:4307588-4306556	Multidrug resistance efflux pump. Could be involved in resistance to puromycin acriflavine and tetraphenylarsonium chloride.	acridine_dye;nucleoside
input/CP182383.fasta	CP182383.1	4384870	4386921	+	mdtO	1-2052/2052	===============	0/0	100.00	100.00	card	AP009048.1:4306557-4304505	Multidrug resistance efflux pump. Could be involved in resistance to puromycin acriflavine and tetraphenylarsonium chloride	acridine_dye;nucleoside
input/CP182383.fasta	CP182383.1	4386918	4388384	+	mdtP	1-1467/1467	===============	0/0	100.00	100.00	card	AP009048.1:4304509-4303042	Multidrug resistance efflux pump. Could be involved in resistance to puromycin acriflavine and tetraphenylarsonium chloride	acridine_dye;nucleoside
input/CP182383.fasta	CP182383.1	4622305	4623678	+	cpxA	1-1374/1374	===============	0/0	100.00	98.98	card	BA000007.3:4905062-4903688	CpxA is a membrane-localized sensor kinase that is activated by envelope stress. It starts a kinase cascade that activates CpxR which promotes efflux complex expression.	aminocoumarin;aminoglycoside
