#FILE	SEQUENCE	START	END	STRAND	GENE	COVERAGE	COVERAGE_MAP	GAPS	%COVERAGE	%IDENTITY	DATABASE	ACCESSION	PRODUCT	RESISTANCE
input/CP182374.fasta	CP182374.1	4688	5320	+	CRP	1-633/633	===============	0/0	100.00	99.21	card	AP009048.1:4154296-4153663	CRP is a global regulator that represses MdtEF multidrug efflux pump expression.	fluoroquinolone;macrolide;penam
input/CP182374.fasta	CP182374.1	175066	176223	+	mdtE	1-1158/1158	===============	0/0	100.00	99.74	card	AP009048.1:3981183-3980025	MdtE is the membrane fusion protein of the MdtEF multidrug efflux complex. It shares 70% sequence similarity with AcrA.	fluoroquinolone;macrolide;penam
input/CP182374.fasta	CP182374.1	176248	179361	+	mdtF	1-3114/3114	===============	0/0	100.00	98.49	card	U00096:3660413-3663527	MdtF is the multidrug inner membrane transporter for the MdtEF-TolC efflux complex.	fluoroquinolone;macrolide;penam
input/CP182374.fasta	CP182374.1	179724	180452	-	gadW	1-729/729	===============	0/0	100.00	94.38	card	CP015085.1:2552440-2551711	GadW is an AraC-family regulator that promotes mdtEF expression to confer multidrug resistance. GadW inhibits GadX-dependent activation. GadW clearly represses gadX and in situations where GadX is missing activates gadA and gadBC.	fluoroquinolone;macrolide;penam
input/CP182374.fasta	CP182374.1	180820	181644	-	gadX	1-825/825	===============	0/0	100.00	97.82	card	AP009048.1:3974604-3975429	GadX is an AraC-family regulator that promotes mdtEF expression to confer multidrug resistance.	fluoroquinolone;macrolide;penam
input/CP182374.fasta	CP182374.1	635687	637060	-	cpxA	1-1374/1374	===============	0/0	100.00	98.76	card	BA000007.3:4905062-4903688	CpxA is a membrane-localized sensor kinase that is activated by envelope stress. It starts a kinase cascade that activates CpxR which promotes efflux complex expression.	aminocoumarin;aminoglycoside
input/CP182374.fasta	CP182374.1	842276	843742	-	mdtP	1-1467/1467	===============	0/0	100.00	98.23	card	AP009048.1:4304509-4303042	Multidrug resistance efflux pump. Could be involved in resistance to puromycin acriflavine and tetraphenylarsonium chloride	acridine_dye;nucleoside
input/CP182374.fasta	CP182374.1	843739	845790	-	mdtO	1-2052/2052	===============	0/0	100.00	98.20	card	AP009048.1:4306557-4304505	Multidrug resistance efflux pump. Could be involved in resistance to puromycin acriflavine and tetraphenylarsonium chloride	acridine_dye;nucleoside
input/CP182374.fasta	CP182374.1	845790	846821	-	mdtN	1-1032/1032	===============	0/0	100.00	98.06	card	AP009048.1:4307588-4306556	Multidrug resistance efflux pump. Could be involved in resistance to puromycin acriflavine and tetraphenylarsonium chloride.	acridine_dye;nucleoside
input/CP182374.fasta	CP182374.1	869484	871127	-	eptA	1-1644/1644	===============	0/0	100.00	99.39	card	AP009048:4340268-4338624	PmrC mediates the modification of Lipid A by the addition of 4-amino-4-deoxy-L-arabinose (L-Ara4N) and phosphoethanolamine resulting in a less negative cell membrane and decreased binding of polymyxin B.	peptide
input/CP182374.fasta	CP182374.1	914630	915763	-	Escherichia_coli_ampC	1-1134/1134	===============	0/0	100.00	97.53	card	U00096.3:4378944-4377810	A class C ampC beta-lactamase (cephalosporinase) enzyme described in Escherichia coli shown clinically to confer resistance to penicillin-like and cephalosporin-class antibiotics.	cephalosporin;penam
input/CP182374.fasta	CP182374.1	1109371	1110603	-	mdtM	1-1233/1233	===============	0/0	100.00	95.86	card	U00096.3:4568519-4567286	Multidrug resistance protein MdtM	acridine_dye;fluoroquinolone;lincosamide;nucleoside;phenicol
input/CP182374.fasta	CP182374.1	1638341	1639498	-	Escherichia_coli_ampH	1-1158/1158	===============	0/0	100.00	99.31	card	AP012030.1:396711-395553	AmpH is a class C ampC-like beta-lactamase and penicillin-binding protein identified in Escherichia coli.	cephalosporin;penam
input/CP182374.fasta	CP182374.1	1726508	1729657	-	acrB	1-3150/3150	===============	0/0	100.00	99.08	card	U00096.3:484403-481253	Protein subunit of AcrA-AcrB-TolC multidrug efflux complex. AcrB functions as a herterotrimer which forms the inner membrane component and is primarily responsible for substrate recognition and energy transduction by acting as a drug/proton antiporter.	cephalosporin;fluoroquinolone;glycylcycline;penam;phenicol;rifamycin;tetracycline;triclosan
input/CP182374.fasta	CP182374.1	1729680	1730873	-	Escherichia_coli_acrA	1-1194/1194	===============	0/0	100.00	99.75	card	U00096.3:485619-484425	AcrA is a subunit of the AcrAB-TolC multidrug efflux system that in E. coli.	cephalosporin;fluoroquinolone;glycylcycline;penam;phenicol;rifamycin;tetracycline;triclosan
input/CP182374.fasta	CP182374.1	1948683	1949355	-	kdpE	1-673/678	===============	0/0	99.26	97.18	card	U00096.3:721733-721055	kdpE is a transcriptional activator that is part of the two-component system KdpD/KdpE that is studied for its regulatory role in potassium transport and has been identified as an adaptive regulator involved in the virulence and intracellular survival of pathogenic bacteria. kdpE regulates a range of virulence loci through direct promoter binding.	aminoglycoside
input/CP182374.fasta	CP182374.1	2111378	2112610	+	Escherichia_coli_mdfA	1-1233/1233	===============	0/0	100.00	96.92	card	JQ394987:0-1233	Multidrug efflux pump in E. coli. This multidrug efflux system was originally identified as the Cmr/CmlA chloramphenicol exporter.	benzalkonium_chloride;rhodamine;tetracycline
input/CP182374.fasta	CP182374.1	2262177	2263925	+	msbA	1-1749/1749	===============	0/0	100.00	99.26	card	U00096.3:966620-968369	MsbA is a multidrug resistance transporter homolog from E. coli and belongs to a superfamily of transporters that contain an adenosine triphosphate (ATP) binding cassette (ABC) which is also called a nucleotide-binding domain (NBD). MsbA is a member of the MDR-ABC transporter group by sequence homology. MsbA transports lipid A a major component of the bacterial outer cell membrane and is the only bacterial ABC transporter that is essential for cell viability.	nitroimidazole
input/CP182374.fasta	CP182374.1	2499822	2501048	-	mdtG	1-1227/1227	===============	0/0	100.00	99.27	card	CP000800.1:1192954-1191727	The MdtG protein also named YceE appears to be a member of the major facilitator superfamily of transporters and it has been reported when overexpressed to increase fosfomycin and deoxycholate resistances. mdtG is a member of the marA-soxS-rob regulon.	fosfomycin
input/CP182374.fasta	CP182374.1	2509679	2510887	-	mdtH	1-1209/1209	===============	0/0	100.00	98.68	card	U00096:1125326-1124117	Multidrug resistance protein MdtH	fluoroquinolone
input/CP182374.fasta	CP182374.1	2704979	2705392	-	H-NS	1-414/414	===============	0/0	100.00	99.03	card	BA000007.3:1738104-1737690	H-NS is a histone-like protein involved in global gene regulation in Gram-negative bacteria. It is a repressor of the membrane fusion protein genes acrE mdtE and emrK as well as nearby genes of many RND-type multidrug exporters.	cephalosporin;cephamycin;fluoroquinolone;macrolide;penam;tetracycline
input/CP182374.fasta	CP182374.1	3013335	3013718	+	marA	1-384/384	===============	0/0	100.00	99.48	card	AP009048.1:1621287-1621671	In the presence of antibiotic stress E. coli overexpresses the global activator protein MarA which besides inducing MDR efflux pump AcrAB also down- regulates synthesis of the porin OmpF.	carbapenem;cephalosporin;cephamycin;fluoroquinolone;glycylcycline;monobactam;penam;penem;phenicol;rifamycin;tetracycline;triclosan
input/CP182374.fasta	CP182374.1	3395112	3395444	-	Escherichia_coli_emrE	1-333/333	===============	0/0	100.00	92.19	card	Z11877.1:485-818	Member of the small MDR (multidrug resistance) family of transporters; in Escherichia coli this protein provides resistance against a number of positively charged compounds including ethidium bromide and erythromycin; proton-dependent secondary transporter which exchanges protons for compound translocation	macrolide
input/CP182374.fasta	CP182374.1	3470001	3471167	-	ugd	1-1167/1167	===============	0/0	100.00	96.92	card	U00096:2099613-2098446	PmrE is required for the synthesis and transfer of 4-amino-4-deoxy-L-arabinose (Ara4N) to Lipid A which allows gram-negative bacteria to resist the antimicrobial activity of cationic antimicrobial peptides and antibiotics such as polymyxin	peptide
input/CP182374.fasta	CP182374.1	3523762	3525009	+	mdtA	1-1248/1248	===============	0/0	100.00	98.16	card	U00096:2154015-2155263	MdtA is the membrane fusion protein of the multidrug efflux complex mdtABC.	aminocoumarin
input/CP182374.fasta	CP182374.1	3525009	3528131	+	mdtB	1-3123/3123	===============	0/0	100.00	99.20	card	U00096:2155262-2158385	MdtB is a transporter that forms a heteromultimer complex with MdtC to form a multidrug transporter. MdtBC is part of the MdtABC-TolC efflux complex.	aminocoumarin
input/CP182374.fasta	CP182374.1	3528132	3531209	+	mdtC	1-3078/3078	===============	0/0	100.00	98.57	card	U00096:2158385-2161463	MdtC is a transporter that forms a heteromultimer complex with MdtB to form a multidrug transporter. MdtBC is part of the MdtABC-TolC efflux complex. In the absence of MdtB MdtC can form a homomultimer complex that results in a functioning efflux complex with a narrower drug specificity. mdtC corresponds to 3 loci in Pseudomonas aeruginosa PAO1 (gene name: muxC/muxB) and 3 loci in Pseudomonas aeruginosa LESB58.	aminocoumarin
input/CP182374.fasta	CP182374.1	3532622	3534025	+	baeS	1-1404/1404	===============	0/0	100.00	99.00	card	AP009048:2165012-2166416	BaeS is a sensor kinase in the BaeSR regulatory system. While it phosphorylates BaeR to increase its activity BaeS is not necessary for overexpressed BaeR to confer resistance.	aminocoumarin;aminoglycoside
input/CP182374.fasta	CP182374.1	3534022	3534744	+	baeR	1-723/723	===============	0/0	100.00	99.17	card	AP009048.1:2166412-2167135	BaeR is a response regulator that promotes the expression of MdtABC and AcrD efflux complexes.	aminocoumarin;aminoglycoside
input/CP182374.fasta	CP182374.1	3709940	3711583	-	yojI	1-1644/1644	===============	0/0	100.00	98.17	card	U00096.3:2308615-2306971	YojI mediates resistance to the peptide antibiotic microcin J25 when it is expressed from a multicopy vector. YojI is capable of pumping out microcin molecules.  The outer membrane protein TolC in addition to YojI is required for export of microcin J25 out of the cell. Microcin J25 is thus the first known substrate for YojI.	peptide
input/CP182374.fasta	CP182374.1	3758659	3759627	+	pmrF	1-969/969	===============	0/0	100.00	99.38	card	U00096:2367070-2368039	PmrF is required for the synthesis and transfer of 4-amino-4-deoxy-L-arabinose (Ara4N) to Lipid A which allows gram-negative bacteria to resist the antimicrobial activity of cationic antimicrobial peptides and antibiotics such as polymyxin. pmrF corresponds to 1 locus in Pseudomonas aeruginosa PAO1 and 1 locus in Pseudomonas aeruginosa LESB58.	peptide
input/CP182374.fasta	CP182374.1	3860884	3862422	-	emrY	1-1539/1539	===============	0/0	100.00	99.16	card	D78168:1591-3130	emrY is a multidrug transport that moves substrates across the inner membrane of the Gram-negative E. coli. It is a homolog of emrB.	tetracycline
input/CP182374.fasta	CP182374.1	3862422	3863477	-	emrK	1-1056/1056	===============	0/0	100.00	98.11	card	D78168:536-1592	emrK is a membrane fusion protein that is a homolog of EmrA. Together with the inner membrane transporter EmrY and the outer membrane channel TolC it mediates multidrug efflux.	tetracycline
input/CP182374.fasta	CP182374.1	3864001	3864615	+	evgA	1-615/615	===============	0/0	100.00	98.86	card	BA000007.3:3212025-3212640	EvgA when phosphorylated is a positive regulator for efflux protein complexes emrKY and mdtEF. While usually phosphorylated in a EvgS dependent manner it can be phosphorylated in the absence of EvgS when overexpressed.	fluoroquinolone;macrolide;penam;tetracycline
input/CP182374.fasta	CP182374.1	3864620	3868213	+	evgS	1-3594/3594	===============	0/0	100.00	99.53	card	U00096:2484373-2487967	EvgS is a sensor protein that phosphorylates the regulatory protein EvgA. evgS corresponds to 1 locus in Pseudomonas aeruginosa PAO1 and 1 locus in Pseudomonas aeruginosa LESB58.	fluoroquinolone;macrolide;penam;tetracycline
input/CP182374.fasta	CP182374.1	3921754	3923058	+	Escherichia_coli_ampC1_beta-lactamase	1-1305/1305	===============	0/0	100.00	98.16	card	FN649414.1:2765050-2766355	An ampC-like beta-lactamase identified from Escherichia coli.	cephalosporin;penam
input/CP182374.fasta	CP182374.1	3954156	3957269	+	acrD	1-3114/3114	===============	0/0	100.00	98.78	card	AP009048.1:2586250-2589364	AcrD is an aminoglycoside efflux pump expressed in E. coli. Its expression can be induced by indole and is regulated by baeRS and cpxAR.	aminoglycoside
input/CP182374.fasta	CP182374.1	3978714	3979190	+	mphB	1-477/477	===============	0/0	100.00	98.11	card	AE005174.2:3397370-3397847	The mphB gene encodes for MPH(2')-II. This enzymes phosphorylates 14-membered and 16-membered macrolides.  It phosphorylates macrolides in GTP- dependent manner at 2'-OH hydroxyl of desosamine sugar of macrolides.	macrolide
input/CP182374.fasta	CP182374.1	4154730	4155260	+	emrR	1-531/531	===============	0/0	100.00	100.00	card	U00096.3:2810769-2811300	EmrR is a negative regulator for the EmrAB-TolC multidrug efflux pump in E. coli. Mutations lead to EmrAB-TolC overexpression.	fluoroquinolone
input/CP182374.fasta	CP182374.1	4155387	4156559	+	emrA	1-1173/1173	===============	0/0	100.00	98.21	card	AP009048:2810082-2811255	EmrA is a membrane fusion protein providing an efflux pathway with EmrB and TolC between the inner and outer membranes of E. coli a Gram-negative bacterium.	fluoroquinolone
input/CP182374.fasta	CP182374.1	4156576	4158114	+	emrB	1-1539/1539	===============	0/0	100.00	98.51	card	U00096:2812615-2814154	emrB is a translocase in the emrB -TolC efflux protein in E. coli. It recognizes substrates including carbonyl cyanide m-chlorophenylhydrazone (CCCP) nalidixic acid and thioloactomycin.	fluoroquinolone
input/CP182374.fasta	CP182374.1	4584792	4586279	+	tolC	1-1488/1488	===============	0/0	100.00	98.39	card	FJ768952:0-1488	TolC is a protein subunit of many multidrug efflux complexes in Gram negative bacteria. It is an outer membrane efflux protein and is constitutively open. Regulation of efflux activity is often at its periplasmic entrance by other components of the efflux complex.	aminocoumarin;aminoglycoside;carbapenem;cephalosporin;cephamycin;fluoroquinolone;glycylcycline;macrolide;penam;penem;peptide;phenicol;rifamycin;tetracycline;triclosan
input/CP182374.fasta	CP182374.1	4608638	4609457	-	bacA	1-820/822	===============	0/0	99.76	98.90	card	U00096.3:3204131-3203309	The bacA gene product (BacA) recycles undecaprenyl pyrophosphate during cell wall biosynthesis which confers resistance to bacitracin.	peptide
input/CP182374.fasta	CP182374.1	4818361	4819023	-	acrS	1-663/663	===============	0/0	100.00	98.79	card	U00096:3413465-3412802	AcrS is a repressor of the AcrAB efflux complex and is associated with the expression of AcrEF. AcrS is believed to regulate a switch between AcrAB and AcrEF efflux.	cephalosporin;cephamycin;fluoroquinolone;glycylcycline;penam;phenicol;rifamycin;tetracycline;triclosan
input/CP182374.fasta	CP182374.1	4819422	4820579	+	acrE	1-1158/1158	===============	0/0	100.00	99.05	card	U00096:3413863-3415021	AcrE is a membrane fusion protein similar to AcrA.	cephalosporin;cephamycin;fluoroquinolone;penam
input/CP182374.fasta	CP182374.1	4820591	4823695	+	acrF	1-3105/3105	===============	0/0	100.00	99.00	card	U00096:3415032-3418137	AcrF is a inner membrane transporter similar to AcrB.	cephalosporin;cephamycin;fluoroquinolone;penam
