#FILE	SEQUENCE	START	END	STRAND	GENE	COVERAGE	COVERAGE_MAP	GAPS	%COVERAGE	%IDENTITY	DATABASE	ACCESSION	PRODUCT	RESISTANCE
input/CP182387.fasta	CP182387.1	240238	241062	+	gadX	1-825/825	===============	0/0	100.00	97.94	card	AP009048.1:3974604-3975429	GadX is an AraC-family regulator that promotes mdtEF expression to confer multidrug resistance.	fluoroquinolone;macrolide;penam
input/CP182387.fasta	CP182387.1	241430	242158	+	gadW	1-729/729	===============	0/0	100.00	94.38	card	CP015085.1:2552440-2551711	GadW is an AraC-family regulator that promotes mdtEF expression to confer multidrug resistance. GadW inhibits GadX-dependent activation. GadW clearly represses gadX and in situations where GadX is missing activates gadA and gadBC.	fluoroquinolone;macrolide;penam
input/CP182387.fasta	CP182387.1	242521	245634	-	mdtF	1-3114/3114	===============	0/0	100.00	98.56	card	U00096:3660413-3663527	MdtF is the multidrug inner membrane transporter for the MdtEF-TolC efflux complex.	fluoroquinolone;macrolide;penam
input/CP182387.fasta	CP182387.1	245659	246816	-	mdtE	1-1158/1158	===============	0/0	100.00	99.66	card	AP009048.1:3981183-3980025	MdtE is the membrane fusion protein of the MdtEF multidrug efflux complex. It shares 70% sequence similarity with AcrA.	fluoroquinolone;macrolide;penam
input/CP182387.fasta	CP182387.1	418196	418828	-	CRP	1-633/633	===============	0/0	100.00	99.53	card	AP009048.1:4154296-4153663	CRP is a global regulator that represses MdtEF multidrug efflux pump expression.	fluoroquinolone;macrolide;penam
input/CP182387.fasta	CP182387.1	471714	474818	-	acrF	1-3105/3105	===============	0/0	100.00	99.03	card	U00096:3415032-3418137	AcrF is a inner membrane transporter similar to AcrB.	cephalosporin;cephamycin;fluoroquinolone;penam
input/CP182387.fasta	CP182387.1	474830	475987	-	acrE	1-1158/1158	===============	0/0	100.00	98.79	card	U00096:3413863-3415021	AcrE is a membrane fusion protein similar to AcrA.	cephalosporin;cephamycin;fluoroquinolone;penam
input/CP182387.fasta	CP182387.1	476386	477048	+	acrS	1-663/663	===============	0/0	100.00	99.40	card	U00096:3413465-3412802	AcrS is a repressor of the AcrAB efflux complex and is associated with the expression of AcrEF. AcrS is believed to regulate a switch between AcrAB and AcrEF efflux.	cephalosporin;cephamycin;fluoroquinolone;glycylcycline;penam;phenicol;rifamycin;tetracycline;triclosan
input/CP182387.fasta	CP182387.1	756894	757713	+	bacA	1-820/822	===============	0/0	99.76	98.54	card	U00096.3:3204131-3203309	The bacA gene product (BacA) recycles undecaprenyl pyrophosphate during cell wall biosynthesis which confers resistance to bacitracin.	peptide
input/CP182387.fasta	CP182387.1	780072	781559	-	tolC	1-1488/1488	===============	0/0	100.00	98.45	card	FJ768952:0-1488	TolC is a protein subunit of many multidrug efflux complexes in Gram negative bacteria. It is an outer membrane efflux protein and is constitutively open. Regulation of efflux activity is often at its periplasmic entrance by other components of the efflux complex.	aminocoumarin;aminoglycoside;carbapenem;cephalosporin;cephamycin;fluoroquinolone;glycylcycline;macrolide;penam;penem;peptide;phenicol;rifamycin;tetracycline;triclosan
input/CP182387.fasta	CP182387.1	1190166	1191704	-	emrB	1-1539/1539	===============	0/0	100.00	99.87	card	U00096:2812615-2814154	emrB is a translocase in the emrB -TolC efflux protein in E. coli. It recognizes substrates including carbonyl cyanide m-chlorophenylhydrazone (CCCP) nalidixic acid and thioloactomycin.	fluoroquinolone
input/CP182387.fasta	CP182387.1	1191721	1192893	-	emrA	1-1173/1173	===============	0/0	100.00	98.21	card	AP009048:2810082-2811255	EmrA is a membrane fusion protein providing an efflux pathway with EmrB and TolC between the inner and outer membranes of E. coli a Gram-negative bacterium.	fluoroquinolone
input/CP182387.fasta	CP182387.1	1193020	1193550	-	emrR	1-531/531	===============	0/0	100.00	100.00	card	U00096.3:2810769-2811300	EmrR is a negative regulator for the EmrAB-TolC multidrug efflux pump in E. coli. Mutations lead to EmrAB-TolC overexpression.	fluoroquinolone
input/CP182387.fasta	CP182387.1	1385187	1385663	-	mphB	1-477/477	===============	0/0	100.00	98.11	card	AE005174.2:3397370-3397847	The mphB gene encodes for MPH(2')-II. This enzymes phosphorylates 14-membered and 16-membered macrolides.  It phosphorylates macrolides in GTP- dependent manner at 2'-OH hydroxyl of desosamine sugar of macrolides.	macrolide
input/CP182387.fasta	CP182387.1	1406898	1410011	-	acrD	1-3114/3114	===============	0/0	100.00	98.88	card	AP009048.1:2586250-2589364	AcrD is an aminoglycoside efflux pump expressed in E. coli. Its expression can be induced by indole and is regulated by baeRS and cpxAR.	aminoglycoside
input/CP182387.fasta	CP182387.1	1441129	1442433	-	Escherichia_coli_ampC1_beta-lactamase	1-1305/1305	===============	0/0	100.00	98.54	card	FN649414.1:2765050-2766355	An ampC-like beta-lactamase identified from Escherichia coli.	cephalosporin;penam
input/CP182387.fasta	CP182387.1	1504692	1505306	-	evgA	1-615/615	===============	0/0	100.00	99.02	card	BA000007.3:3212025-3212640	EvgA when phosphorylated is a positive regulator for efflux protein complexes emrKY and mdtEF. While usually phosphorylated in a EvgS dependent manner it can be phosphorylated in the absence of EvgS when overexpressed.	fluoroquinolone;macrolide;penam;tetracycline
input/CP182387.fasta	CP182387.1	1505830	1506885	+	emrK	1-1056/1056	===============	0/0	100.00	99.72	card	D78168:536-1592	emrK is a membrane fusion protein that is a homolog of EmrA. Together with the inner membrane transporter EmrY and the outer membrane channel TolC it mediates multidrug efflux.	tetracycline
input/CP182387.fasta	CP182387.1	1506885	1508423	+	emrY	1-1539/1539	===============	0/0	100.00	98.83	card	D78168:1591-3130	emrY is a multidrug transport that moves substrates across the inner membrane of the Gram-negative E. coli. It is a homolog of emrB.	tetracycline
input/CP182387.fasta	CP182387.1	1668734	1669966	+	Escherichia_coli_mdfA	1-1233/1233	===============	0/0	100.00	96.92	card	JQ394987:0-1233	Multidrug efflux pump in E. coli. This multidrug efflux system was originally identified as the Cmr/CmlA chloramphenicol exporter.	benzalkonium_chloride;rhodamine;tetracycline
input/CP182387.fasta	CP182387.1	1786695	1788443	+	msbA	1-1749/1749	===============	0/0	100.00	99.26	card	U00096.3:966620-968369	MsbA is a multidrug resistance transporter homolog from E. coli and belongs to a superfamily of transporters that contain an adenosine triphosphate (ATP) binding cassette (ABC) which is also called a nucleotide-binding domain (NBD). MsbA is a member of the MDR-ABC transporter group by sequence homology. MsbA transports lipid A a major component of the bacterial outer cell membrane and is the only bacterial ABC transporter that is essential for cell viability.	nitroimidazole
input/CP182387.fasta	CP182387.1	1923715	1924941	-	mdtG	1-1227/1227	===============	0/0	100.00	99.27	card	CP000800.1:1192954-1191727	The MdtG protein also named YceE appears to be a member of the major facilitator superfamily of transporters and it has been reported when overexpressed to increase fosfomycin and deoxycholate resistances. mdtG is a member of the marA-soxS-rob regulon.	fosfomycin
input/CP182387.fasta	CP182387.1	1933572	1934780	-	mdtH	1-1209/1209	===============	0/0	100.00	98.51	card	U00096:1125326-1124117	Multidrug resistance protein MdtH	fluoroquinolone
input/CP182387.fasta	CP182387.1	2133279	2133692	-	H-NS	1-414/414	===============	0/0	100.00	99.28	card	BA000007.3:1738104-1737690	H-NS is a histone-like protein involved in global gene regulation in Gram-negative bacteria. It is a repressor of the membrane fusion protein genes acrE mdtE and emrK as well as nearby genes of many RND-type multidrug exporters.	cephalosporin;cephamycin;fluoroquinolone;macrolide;penam;tetracycline
input/CP182387.fasta	CP182387.1	2590888	2591271	+	marA	1-384/384	===============	0/0	100.00	99.48	card	AP009048.1:1621287-1621671	In the presence of antibiotic stress E. coli overexpresses the global activator protein MarA which besides inducing MDR efflux pump AcrAB also down- regulates synthesis of the porin OmpF.	carbapenem;cephalosporin;cephamycin;fluoroquinolone;glycylcycline;monobactam;penam;penem;phenicol;rifamycin;tetracycline;triclosan
input/CP182387.fasta	CP182387.1	3010735	3011067	-	Escherichia_coli_emrE	1-333/333	===============	0/0	100.00	92.49	card	Z11877.1:485-818	Member of the small MDR (multidrug resistance) family of transporters; in Escherichia coli this protein provides resistance against a number of positively charged compounds including ethidium bromide and erythromycin; proton-dependent secondary transporter which exchanges protons for compound translocation	macrolide
input/CP182387.fasta	CP182387.1	3135114	3136280	-	ugd	1-1167/1167	===============	0/0	100.00	96.06	card	U00096:2099613-2098446	PmrE is required for the synthesis and transfer of 4-amino-4-deoxy-L-arabinose (Ara4N) to Lipid A which allows gram-negative bacteria to resist the antimicrobial activity of cationic antimicrobial peptides and antibiotics such as polymyxin	peptide
input/CP182387.fasta	CP182387.1	3193110	3194357	+	mdtA	1-1248/1248	===============	0/0	100.00	98.16	card	U00096:2154015-2155263	MdtA is the membrane fusion protein of the multidrug efflux complex mdtABC.	aminocoumarin
input/CP182387.fasta	CP182387.1	3194357	3197479	+	mdtB	1-3123/3123	===============	0/0	100.00	97.95	card	U00096:2155262-2158385	MdtB is a transporter that forms a heteromultimer complex with MdtC to form a multidrug transporter. MdtBC is part of the MdtABC-TolC efflux complex.	aminocoumarin
input/CP182387.fasta	CP182387.1	3197480	3200557	+	mdtC	1-3078/3078	===============	0/0	100.00	98.12	card	U00096:2158385-2161463	MdtC is a transporter that forms a heteromultimer complex with MdtB to form a multidrug transporter. MdtBC is part of the MdtABC-TolC efflux complex. In the absence of MdtB MdtC can form a homomultimer complex that results in a functioning efflux complex with a narrower drug specificity. mdtC corresponds to 3 loci in Pseudomonas aeruginosa PAO1 (gene name: muxC/muxB) and 3 loci in Pseudomonas aeruginosa LESB58.	aminocoumarin
input/CP182387.fasta	CP182387.1	3201970	3203373	+	baeS	1-1404/1404	===============	0/0	100.00	99.57	card	AP009048:2165012-2166416	BaeS is a sensor kinase in the BaeSR regulatory system. While it phosphorylates BaeR to increase its activity BaeS is not necessary for overexpressed BaeR to confer resistance.	aminocoumarin;aminoglycoside
input/CP182387.fasta	CP182387.1	3203370	3204092	+	baeR	1-723/723	===============	0/0	100.00	99.31	card	AP009048.1:2166412-2167135	BaeR is a response regulator that promotes the expression of MdtABC and AcrD efflux complexes.	aminocoumarin;aminoglycoside
input/CP182387.fasta	CP182387.1	3343836	3345479	-	yojI	1-1644/1644	===============	0/0	100.00	98.48	card	U00096.3:2308615-2306971	YojI mediates resistance to the peptide antibiotic microcin J25 when it is expressed from a multicopy vector. YojI is capable of pumping out microcin molecules.  The outer membrane protein TolC in addition to YojI is required for export of microcin J25 out of the cell. Microcin J25 is thus the first known substrate for YojI.	peptide
input/CP182387.fasta	CP182387.1	3392551	3393519	+	pmrF	1-969/969	===============	0/0	100.00	99.38	card	U00096:2367070-2368039	PmrF is required for the synthesis and transfer of 4-amino-4-deoxy-L-arabinose (Ara4N) to Lipid A which allows gram-negative bacteria to resist the antimicrobial activity of cationic antimicrobial peptides and antibiotics such as polymyxin. pmrF corresponds to 1 locus in Pseudomonas aeruginosa PAO1 and 1 locus in Pseudomonas aeruginosa LESB58.	peptide
input/CP182387.fasta	CP182387.1	3613008	3613680	+	kdpE	1-673/678	===============	0/0	99.26	97.18	card	U00096.3:721733-721055	kdpE is a transcriptional activator that is part of the two-component system KdpD/KdpE that is studied for its regulatory role in potassium transport and has been identified as an adaptive regulator involved in the virulence and intracellular survival of pathogenic bacteria. kdpE regulates a range of virulence loci through direct promoter binding.	aminoglycoside
input/CP182387.fasta	CP182387.1	3832347	3833540	+	Escherichia_coli_acrA	1-1194/1194	===============	0/0	100.00	99.83	card	U00096.3:485619-484425	AcrA is a subunit of the AcrAB-TolC multidrug efflux system that in E. coli.	cephalosporin;fluoroquinolone;glycylcycline;penam;phenicol;rifamycin;tetracycline;triclosan
input/CP182387.fasta	CP182387.1	3833563	3836712	+	acrB	1-3150/3150	===============	0/0	100.00	99.11	card	U00096.3:484403-481253	Protein subunit of AcrA-AcrB-TolC multidrug efflux complex. AcrB functions as a herterotrimer which forms the inner membrane component and is primarily responsible for substrate recognition and energy transduction by acting as a drug/proton antiporter.	cephalosporin;fluoroquinolone;glycylcycline;penam;phenicol;rifamycin;tetracycline;triclosan
input/CP182387.fasta	CP182387.1	3923899	3925056	+	Escherichia_coli_ampH	1-1158/1158	===============	0/0	100.00	98.88	card	AP012030.1:396711-395553	AmpH is a class C ampC-like beta-lactamase and penicillin-binding protein identified in Escherichia coli.	cephalosporin;penam
input/CP182387.fasta	CP182387.1	4467031	4468263	+	mdtM	1-1233/1233	===============	0/0	100.00	96.19	card	U00096.3:4568519-4567286	Multidrug resistance protein MdtM	acridine_dye;fluoroquinolone;lincosamide;nucleoside;phenicol
input/CP182387.fasta	CP182387.1	4641188	4642321	+	Escherichia_coli_ampC	1-1134/1134	===============	0/0	100.00	97.71	card	U00096.3:4378944-4377810	A class C ampC beta-lactamase (cephalosporinase) enzyme described in Escherichia coli shown clinically to confer resistance to penicillin-like and cephalosporin-class antibiotics.	cephalosporin;penam
input/CP182387.fasta	CP182387.1	4684538	4686181	+	eptA	1-1644/1644	===============	0/0	100.00	99.39	card	AP009048:4340268-4338624	PmrC mediates the modification of Lipid A by the addition of 4-amino-4-deoxy-L-arabinose (L-Ara4N) and phosphoethanolamine resulting in a less negative cell membrane and decreased binding of polymyxin B.	peptide
input/CP182387.fasta	CP182387.1	4708901	4709932	+	mdtN	1-1032/1032	===============	0/0	100.00	98.16	card	AP009048.1:4307588-4306556	Multidrug resistance efflux pump. Could be involved in resistance to puromycin acriflavine and tetraphenylarsonium chloride.	acridine_dye;nucleoside
input/CP182387.fasta	CP182387.1	4709932	4711983	+	mdtO	1-2052/2052	===============	0/0	100.00	98.73	card	AP009048.1:4306557-4304505	Multidrug resistance efflux pump. Could be involved in resistance to puromycin acriflavine and tetraphenylarsonium chloride	acridine_dye;nucleoside
input/CP182387.fasta	CP182387.1	4711980	4713446	+	mdtP	1-1467/1467	===============	0/0	100.00	98.23	card	AP009048.1:4304509-4303042	Multidrug resistance efflux pump. Could be involved in resistance to puromycin acriflavine and tetraphenylarsonium chloride	acridine_dye;nucleoside
input/CP182387.fasta	CP182387.1	4919752	4921125	+	cpxA	1-1374/1374	===============	0/0	100.00	98.76	card	BA000007.3:4905062-4903688	CpxA is a membrane-localized sensor kinase that is activated by envelope stress. It starts a kinase cascade that activates CpxR which promotes efflux complex expression.	aminocoumarin;aminoglycoside
