#FILE	SEQUENCE	START	END	STRAND	GENE	COVERAGE	COVERAGE_MAP	GAPS	%COVERAGE	%IDENTITY	DATABASE	ACCESSION	PRODUCT	RESISTANCE
input/NZ_CP199930.fasta	NZ_CP199930.1	675015	676550	-	Klebsiella_pneumoniae_KpnH	1-1539/1539	========/======	5/7	99.68	84.30	card	ASTU01000063.1:61248-62787	KpnH consists of ~511 residues resembles EmrB of E. coli and is probably a translocase in the KpnGH-TolC efflux protein in K. pneumoniae. Disruption of the pump components KpnG-KpnH signficantly decrease resistance to azithromycin ceftazidime ciprofloxacin ertapenem erythromycin gentamicin imipenem ticarcillin norfloxacin polymyxin-B piperacillin spectinomycin tobramycin and streptomycin.	aminoglycoside;carbapenem;cephalosporin;fluoroquinolone;macrolide;penam;penem;peptide
input/NZ_CP199930.fasta	NZ_CP199930.1	676566	677738	-	Klebsiella_pneumoniae_KpnG	1-1173/1173	===============	0/0	100.00	98.81	card	ACWO01000051.1:22092-23265	KpnG consists of ~390 residues and resembles EmrA of E. coli. Disruption of the pump components KpnG-KpnH signficantly decrease resistance to azithromycin ceftazidime ciprofloxacin ertapenem erythromycin gentamicin imipenem ticarcillin norfloxacin polymyxin-B piperacillin spectinomycin tobramycin and streptomycin	aminoglycoside;carbapenem;cephalosporin;fluoroquinolone;macrolide;penam;penem;peptide
input/NZ_CP199930.fasta	NZ_CP199930.1	677885	678394	-	emrR	1-510/531	===============	0/0	96.05	83.14	card	U00096.3:2810769-2811300	EmrR is a negative regulator for the EmrAB-TolC multidrug efflux pump in E. coli. Mutations lead to EmrAB-TolC overexpression.	fluoroquinolone
input/NZ_CP199930.fasta	NZ_CP199930.1	745186	748338	-	oqxB	1-3153/3153	===============	0/0	100.00	98.73	card	EU370913.1:47850-51003	RND efflux pump conferring resistance to fluoroquinolone	diaminopyrimidine;fluoroquinolone;glycylcycline;nitrofuran;tetracycline
input/NZ_CP199930.fasta	NZ_CP199930.1	748362	749537	-	oqxA	1-1176/1176	===============	0/0	100.00	99.15	card	EU370913.1:46651-47827	RND efflux pump conferring resistance to fluoroquinolone	diaminopyrimidine;fluoroquinolone;glycylcycline;nitrofuran;tetracycline
input/NZ_CP199930.fasta	NZ_CP199930.1	944723	947836	-	acrD	1-3114/3114	========/======	2/6	99.90	80.11	card	AP009048.1:2586250-2589364	AcrD is an aminoglycoside efflux pump expressed in E. coli. Its expression can be induced by indole and is regulated by baeRS and cpxAR.	aminoglycoside
input/NZ_CP199930.fasta	NZ_CP199930.1	1251110	1251822	-	baeR	1-713/723	===============	0/0	98.62	81.49	card	AP009048.1:2166412-2167135	BaeR is a response regulator that promotes the expression of MdtABC and AcrD efflux complexes.	aminocoumarin;aminoglycoside
input/NZ_CP199930.fasta	NZ_CP199930.1	1254711	1257788	-	mdtC	1-3078/3078	===============	0/0	100.00	81.77	card	U00096:2158385-2161463	MdtC is a transporter that forms a heteromultimer complex with MdtB to form a multidrug transporter. MdtBC is part of the MdtABC-TolC efflux complex. In the absence of MdtB MdtC can form a homomultimer complex that results in a functioning efflux complex with a narrower drug specificity. mdtC corresponds to 3 loci in Pseudomonas aeruginosa PAO1 (gene name: muxC/muxB) and 3 loci in Pseudomonas aeruginosa LESB58.	aminocoumarin
input/NZ_CP199930.fasta	NZ_CP199930.1	1257789	1260911	-	mdtB	1-3123/3123	========/======	2/4	99.94	81.18	card	U00096:2155262-2158385	MdtB is a transporter that forms a heteromultimer complex with MdtC to form a multidrug transporter. MdtBC is part of the MdtABC-TolC efflux complex.	aminocoumarin
input/NZ_CP199930.fasta	NZ_CP199930.1	1732211	1732615	-	H-NS	1-405/414	===============	0/0	97.83	87.16	card	BA000007.3:1738104-1737690	H-NS is a histone-like protein involved in global gene regulation in Gram-negative bacteria. It is a repressor of the membrane fusion protein genes acrE mdtE and emrK as well as nearby genes of many RND-type multidrug exporters.	cephalosporin;cephamycin;fluoroquinolone;macrolide;penam;tetracycline
input/NZ_CP199930.fasta	NZ_CP199930.1	2310844	2311212	+	marA	1-369/384	===============	0/0	96.09	81.30	card	AP009048.1:1621287-1621671	In the presence of antibiotic stress E. coli overexpresses the global activator protein MarA which besides inducing MDR efflux pump AcrAB also down- regulates synthesis of the porin OmpF.	carbapenem;cephalosporin;cephamycin;fluoroquinolone;glycylcycline;monobactam;penam;penem;phenicol;rifamycin;tetracycline;triclosan
input/NZ_CP199930.fasta	NZ_CP199930.1	2331321	2332181	+	SHV-108	1-861/861	===============	0/0	100.00	99.53	card	HM751100:0-861	SHV-108 is a beta-lactamase found in Klebsiella pneumoniae.	carbapenem;cephalosporin;penam
input/NZ_CP199930.fasta	NZ_CP199930.1	2372227	2372556	-	Klebsiella_pneumoniae_KpnF	1-330/330	===============	0/0	100.00	100.00	card	AP006725.1:2484238-2484568	KpnF subunit of KpnEF resembles EbrAB from E. coli. Mutation in KpnEF resulted in increased susceptibility to cefepime ceftriaxon colistin erythromycin rifampin tetracycline and streptomycin as well as enhanced sensitivity toward sodium dodecyl sulfate deoxycholate dyes benzalkonium chloride chlorhexidine and triclosan.	aminoglycoside;cephalosporin;macrolide;peptide;rifamycin;tetracycline
input/NZ_CP199930.fasta	NZ_CP199930.1	2372543	2372905	-	Klebsiella_pneumoniae_KpnE	1-363/363	===============	0/0	100.00	100.00	card	AP006725.1:2483889-2484252	KpnE subunit of KpnEF resembles EbrAB from E. coli. Mutation in KpnEF resulted in increased susceptibility to cefepime ceftriaxon colistin erythromycin rifampin tetracycline and streptomycin as well as enhanced sensitivity toward sodium dodecyl sulfate deoxycholate dyes benzalkonium chloride chlorhexidine and triclosan	aminoglycoside;cephalosporin;macrolide;peptide;rifamycin;tetracycline
input/NZ_CP199930.fasta	NZ_CP199930.1	2498114	2499238	+	Klebsiella_pneumoniae_OmpK37	1-1125/1125	===============	0/0	100.00	99.29	card	AJ011502.1:300-1425	Klebsiella pneumoniae outer membrane porin protein. Is preferentially detected in porin-deficient strains. Functional characterization of this new porin revealed a narrower pore than those of porins OmpK35 and OmpK36 which did not allow penetration by certain beta-lactams. Also when a resistant strain expresses porin OmpK37 is less susceptible to cefotaxime and cefoxitin than when it is expressing either OmpK36 or OmpK35.	carbapenem;cephalosporin;cephamycin;monobactam;penam;penem
input/NZ_CP199930.fasta	NZ_CP199930.1	3016317	3018065	-	msbA	1-1749/1749	===============	0/0	100.00	80.62	card	U00096.3:966620-968369	MsbA is a multidrug resistance transporter homolog from E. coli and belongs to a superfamily of transporters that contain an adenosine triphosphate (ATP) binding cassette (ABC) which is also called a nucleotide-binding domain (NBD). MsbA is a member of the MDR-ABC transporter group by sequence homology. MsbA transports lipid A a major component of the bacterial outer cell membrane and is the only bacterial ABC transporter that is essential for cell viability.	nitroimidazole
input/NZ_CP199930.fasta	NZ_CP199930.1	3445900	3446253	-	ramA	21-375/375	========/======	1/1	94.40	80.84	card	JQ727668:0-375	RamA (resistance antibiotic multiple) is a positive regulator of AcrAB-TolC and leads to high level multidrug resistance in Klebsiella pneumoniae Salmonella enterica and Enterobacter aerugenes increasing the expression of both the mar operon as well as AcrAB. RamA also decreases OmpF expression.	carbapenem;cephalosporin;cephamycin;fluoroquinolone;glycylcycline;monobactam;penam;penem;phenicol;rifamycin;tetracycline;triclosan
input/NZ_CP199930.fasta	NZ_CP199930.1	3604595	3605788	+	Klebsiella_pneumoniae_acrA	1-1197/1197	========/======	2/3	99.75	97.74	card	AJ318073.1:793-1990	AcrA is a subunit of the AcrAB multidrug efflux system that in K. pneumoniae which is encoded by the acrRAB operon.	cephalosporin;fluoroquinolone;glycylcycline;penam;phenicol;rifamycin;tetracycline;triclosan
input/NZ_CP199930.fasta	NZ_CP199930.1	3605811	3608955	+	acrB	1-3148/3150	========/======	5/9	99.75	83.85	card	U00096.3:484403-481253	Protein subunit of AcrA-AcrB-TolC multidrug efflux complex. AcrB functions as a herterotrimer which forms the inner membrane component and is primarily responsible for substrate recognition and energy transduction by acting as a drug/proton antiporter.	cephalosporin;fluoroquinolone;glycylcycline;penam;phenicol;rifamycin;tetracycline;triclosan
input/NZ_CP199930.fasta	NZ_CP199930.1	4180633	4181052	-	FosA6	1-420/420	===============	0/0	100.00	98.33	card	KU254579.1:59421-59841	fosA6 is a plasmid-encoded enzyme that confers resistance to fosfomycin in Escherichia coli by breaking the epoxide ring of the molecule.	fosfomycin
input/NZ_CP199930.fasta	NZ_CP199930.1	4803879	4805245	+	cpxA	1-1367/1374	===============	0/0	99.49	82.08	card	BA000007.3:4905062-4903688	CpxA is a membrane-localized sensor kinase that is activated by envelope stress. It starts a kinase cascade that activates CpxR which promotes efflux complex expression.	aminocoumarin;aminoglycoside
input/NZ_CP199930.fasta	NZ_CP199930.1	5327432	5328064	-	CRP	1-633/633	===============	0/0	100.00	88.15	card	AP009048.1:4154296-4153663	CRP is a global regulator that represses MdtEF multidrug efflux pump expression.	fluoroquinolone;macrolide;penam
